{
  "name": "stallari-email-adapter",
  "aliases": ["sidereal-email-adapter"],
  "title": "Email Adapter",
  "description": "Domain adapter for email — canonical email_* tools with per-provider transforms (Fastmail, Gmail)",
  "version": "0.1.0",
  "author": "groupthink-dev",
  "license": "MIT",
  "icon": "/icons/stallari-email-adapter.svg",
  "tier": "certified",
  "author_type": "first-party",
  "readiness": "production",
  "contract": "email-v1",
  "repository": "https://github.com/groupthink-dev/stallari-email-adapter",
  "install": {
    "runtime": "uv",
    "package": "stallari-email-adapter"
  },
  "setup": {
    "auth_model": "none"
  },
  "conformance": {
    "required": "3/3",
    "recommended": "2/2",
    "optional": "2/3",
    "last_tested": "2026-03-25"
  },
  "notes": "v2 domain adapter. Proxies to provider MCPs (fastmail-blade-mcp, gmail-blade-mcp) with parameter/response normalisation.",
  "hidden": true
}
